Sentiment,Text
neutral,COPYRIGHT AFX News and AFX Financial News Logo are registered trademarks of AFX News Limited
neutral,Satama and Trainers ' House will remain as names and independent brands of the business areas .
negative,Prices and delivery volumes of broadband products decreased significantly in 2005 .
positive,"When open next year , it will be the largest facility in the world to produce diesel fuel from renewable feedstock such as palm oil and animal fat ."
neutral,The tower 's engineers have created an 18 degree westward lean - four times the inclination on the Leaning Tower of Pisa - using diagrid structures that are aligned geometrically using Tekla Structures BIM ( Building Information Modeling ) software .
positive,"A purchase agreement for 7,200 tons of gasoline with delivery at the Hamina terminal , Finland , was signed with Neste Oil OYj at the average Platts index for this September plus eight US dollars per month ."
negative,"In addition , the company will reduce a maximum of ten jobs ."
neutral,Changes to the as-built models from the design were communicated to the subcontractors to accommodate them into the steel and GRC fabrication process .
neutral,"The sale , comprising the margarine business in Finland and Poland , follows the approval of the Polish competition authorities earlier in October ."
positive,Ponsse projects the forest machine markets to improve more than expected in 2010 from the previous year .
neutral,The financial details of the transaction were not disclosed .
positive,"In accordance with our strategy , we strengthened our local presence by establishing a representative office in South Africa in October ."
neutral,The handset maker did not disclose any financial details .
neutral,The Kyroskoski investment is to be completed in late 2011 and the +_+Ænekoski investment in the spring of 2012 .
negative,The Group 's order portfolio decreased from EUR 42.9 mn in 9-2007 to EUR 33.3 mn in 2-2008 .
neutral,"The most interesting export markets will be Russia , the Baltic countries and Scandinavia ."
positive,"`` The acquisition of Sampo Bank makes strategic sense for DB , '' says Lindsey Liddell , director of Fitch Ratings 's Financial Institutions Group ."
neutral,"HELSINKI AFX - Cargotec said it has bought a 95 pct stake in Indital Construction Machinery Ltd , a Bangalore-based company that makes fork lift trucks and mobile cranes , for an undisclosed sum ."
neutral,The company has 120 employees and annual sales of approximately EUR16m .
positive,Metso said it has won an order worth around 40 mln eur to supply a kraftliner board machine to China 's Lee & Man Paper Co. .
positive,It delivers a different user experience and enables us to widen the market we can address . ''
neutral,"HUHTAMAKI OYJ STOCK EXCHANGE RELEASE , 16.9.2008 AT 13.32 Huhtamaki 's Capital Markets Day for institutional investors and analysts is held in Espoo , September 16 , 2008 starting at 13.30 pm Finnish time ."
positive,"Ixonos estimates that it will hire 20 specialists in mechanical engineering , electronics design , and R&D for its new unit in Jyvaeskylae by the end of 2009 ."
neutral,Alma Media 's net sales in 2009 totalled MEUR 307.8 with an operating margin of 13.5 per cent .
neutral,The iPad application joins the iPhone app as part of Monster 's range of mobile applications for job hunting .
neutral,No service pricing details were disclosed .
positive,Profit for the period increased from EUR 2.9 mn to EUR 10.5 mn .
positive,"( ADP News ) - Nov 28 , 2008 - Finnish power-supply solutions provider Efore Oyj ( OMX : EFO1V ) announced today the launch of OPUS DC , the latest power system in its OPUS product line ."
positive,One of my colleagues summed up the E7 quite aptly when he remarked : `` Fantastic hardware .
positive,"Kesko Agro Eesti , the retailer and wholesaler of grain , agricultural and warehousing machinery and accessories , had net sales of 81 million euros in 2007 , an increase by one-tenth over the preceding year ."
neutral,"Sponda is a property investment company , specialising in commercial properties in the largest cities in Finland and Russia ."
positive,"With the measures , Suominen Corporation aims to ensure the competitiveness of the Flexible Packaging business in the long term ."
neutral,"Solvay S.A. has engaged Poyry to provide project management , engineering , procurement , and site services for a hydrogen peroxide production plant to be built by a Solvay-BASF joint venture at BASF 's Zandvliet site , Belgium ."
neutral,An earn-out payment of up to 4.0 mln euro ( $ 5.3 mln ) can also be paid depending on Intellibis financial performance in 2007 .
positive,The EPS outlook was increased by 5.6 pct for 2007 and 7.0 pct for 2008 .
neutral,"Metsaliitto will sell 1.1 million B shares of Neomarkka , accounting for about 18.3 pct of Neomarkka 's equity and about 12.7 pct of the voting rights ."
positive,"Ragutis , which is based in Lithuania 's second-largest city Kaunas , boosted its sales last year 22.3 per cent to 36.4 million liters ."
positive,"Cost savings will then rise to some 20 mln eur a year from 2007 , OKO said ."
neutral,"According to the company , the lay-offs will be temporary ."
neutral,"The purchase price will be paid in cash upon the closure of the transaction , scheduled for April 1 , 2009 ."
neutral,"In November , the Finnish government decreased its ownership in the company further to 31.1 percent from 38 percent ."
neutral,"Finnish holding company Panostaja Oyj said on June 12 , 2007 it has signed a letter of intent to acquire local Lahden Lampokasittely Oy and Heatmasters Oy , active in the heat treatment of metals , for a total 3.1 mln euro ( $ 4.1 mln ) ."
neutral,"Member of the HK Ruokatalo Group in Finland , Scan , is launching a joint venture slaughterhouse with Team Ugglarp in Sk+_ne , southern Sweden ."
negative,"In July-September 2009 , Konecranes ' sales decreased to EUR 368.7 mn from EUR 520.4 mn in July-September 2008 ."
positive,"However , the total orders received will still be above last year s levels ."
positive,"The upgrade is intended to raise the network capacity from 450 MHz to 630 MHz in several cities , enabling bi-directional services for digital television as well as broadband data ."
positive,"Raisio 's bid to buy Glisten is a `` win-win '' deal for both companies , the chairman of the UK snacks firm told just-food today 10 February ."
neutral,`` Rapala is excited to be partnering with RBFF and other industry leaders on this holiday promotion . ''
neutral,These savings will have full impact as of the beginning of 2007 .
neutral,One of the largest projects of the magazine division of SanomaWSOY - Sanoma Magazines International in 2006 became launch of the Russian magazine Gloriya .
positive,"Net income from life insurance doubled to EUR 6.8 mn from EUR 3.2 mn , and net income from non-life insurance rose to EUR 5.2 mn from EUR 1.5 mn in the corresponding period in 2009 ."
negative,The administrators have indicated a need for 900 job cuts at the Irish insurer over the next 15 months .
positive,"However , the bottom-line result improved thanks to positive financial items ."
neutral,Finnish aluminium products manufacturer Nordic Aluminium Plc ( OMX Helsinki : NOA1V ) reported on Monday ( 18 August ) an operating profit of EUR7 .9 m on net sales of EUR55 .2 m for the period January-June 2008 .
neutral,"It operates under three distinct brands : United Supermarkets , Market Street and United Supermercado ."
neutral,"The 10,000-odd square metre plot that Stockmann has bought for the Nevsky Center shopping center is located on Nevsky Prospect , St Petersburg 's high street , next to the Vosstaniya Square underground station , in the immediate vicinity of Moscow Station ."
negative,"According to Swedish authorities , traces of the very toxic osmium tetroxide have been found on the coast of Per+Æmeri , the Northernmost part of the Gulf of Bothnia ."
positive,"The iTunes-based material will be accessible on Windows-based or Macintosh computers and transferable to portable devices , including Apple 's iPods ."
neutral,Queen Elizabeth to meet Joe Biden in person after G-7
neutral,`` The new unit is a major investment in the Finnish media scene .
negative,"Finnish Food Workers ' Union SEL plans to hasten its collective bargaining with a two-day strike that would begin on 7 April 2010 , in Finland ."
neutral,"561,470 new shares under 2003 option rights plan Packaging company Huhtamaki Oyj reported on Monday that a total of 561,470 new shares of the company have been issued based on share subscriptions under its 2003 option rights plan ."
neutral,"Sarantel , based in Wellingborough , UK , designs high-performance antennas for portable wireless devices ."
neutral,"As of August 2008 , Glaston 's North Asian sales and service region is upgraded to a new market area , North Asia ."
neutral,Two other sites will be included later on .
neutral,Olli-Pekka Laine has been appointed as the Chairman and Erkki Pehu-Lehtonen as the Vice Chairman of the Board .
negative,"ADPnews - Sep 28 , 2009 - Finnish silicon wafers maker Okmetic Oyj HEL : OKM1V said it will reduce the number of its clerical workers by 22 worldwide as a result of personnel negotiations completed today ."
negative,"Operating profit for the 12-month period decreased from EUR17 .9 m while net sales increased from EUR58 .3 m , as compared to 2007 ."
negative,Possible personnel reductions concern approximately 104 people .
negative,"Sampo Bank 's market share of lending was 13.6 % , down from 14.4 % in the first quarter of 2008 ."
neutral,"Also Finnish Industry Investment , a government-owned investment company , will participate in the project ."
positive,"Furthermore , efficiency improvement measures initiated earlier are now bearing fruit , '' CEO Jan Lang said ."
neutral,"According to L+Ænnen Tehtaat 's CEO Matti Karppinen , the company aims to deliver fish products to its customers a day earlier than it currently does ."
negative,"Tallink Silja attributes the significant drop to problems with the booking system that was taken into operation in October , the sale of trailer ferry ` Sky Wind ' and the route between Stockholm and Riga , which has won passengers from the Helsinki-Stockholm route ."
neutral,China's births may fall below 10m annually in next five years
negative,"Furthermore , sales of new passenger cars and light commercial vehicles in the country declined by 5.4 % year-on-year last month ."
negative,"Operating profit totalled EUR 1.22 mn , down from EUR 3.56 mn in the first quarter of 2008 ."
neutral,Active shipping is essential for Finland .
positive,"Metso expects its net sales to increase by about 10 % in 2008 , at comparable exchange rates ."
negative,"In the Baltic countries , sales fell by 40.2 % , and in Russia , by 23.2 % in terms of euros , and by 10.7 % in terms of local currency ."
positive,Finnish elevators and escalators maker KONE Corporation said on Tuesday ( 18 March ) that it has received a major order from Sir Robert McAlpine to supply all elevators and escalators for the Watermark Place project in the City of London .
neutral,"Under the agreement , Japrotek will deliver nine storage tanks in the volume range of 1,000 cu m to 3,000 cu m with included agitators ."
positive,"Tectia Corporation HEL : TEC1V , a provider of real-time security solutions , today announced that it has appointed LAN2LAN , a provider of IT services in the UK , to distribute its data security and manage file transfer software ."
positive,"In the first nine months of 2010 , the company 's net loss narrowed to EUR 415,000 from EUR 7.4 million for the corresponding period of 2009 ."
positive,It will combine and renew the contents and functionality of the current systems for funding and online service as well as their maintenance .
neutral,The price will be specified at the completion date .
neutral,"The approximately 20,000 dwt vessel has been ordered from India ."
neutral,"The Group 's turnover in 2006 was EUR 39.2 million , and operating profit was EUR 3.9 million ."
positive,"`` They would invest not only in the physical infrastructure , but would also provide know-how for managing and developing science and technology parks , '' said Sunrise Valley director Andrius Bagdonas ."
neutral,We do hope that this will in the future turn out to be a novel method for the prevention of alcohol and tobacco smoking associated oral cancers .
neutral,"While I cant understand what theyre saying , its impressive to watch him hit that ball at those speeds ."
neutral,"Glaston 's share GLA1V is listed on the NASDAQ OMX Helsinki , Mid Cap List ."
neutral,"To choose BasWare as the tools for our Financial Service seemed like a natural continuation of our cooperation '' , says Tommi Leskinen , Financial Applications Manager , Neste Oil Corporation ."
negative,Full-year operating result for 2008 was 3.6 million negative .
neutral,"Approximately SEK 166 million in repayments has been demanded for overcharging in the Stockholm area , with the remaining SEK 87 million taken from the Western coast , the inspectorate said ."
neutral,"The company said that the operations will be sold to a newly established company , CPS GmbH , where the present management of the plastics business is a co-owner ."
positive,Commission income rose by 25.7 % to EUR 16.1 mn from EUR 12.8 mn in 2004 .
neutral,"Motorola , the world 's second-largest maker of cell phones , unveiled the new phone Tuesday in a bid to resurrect its ailing handset business ."
positive,"( ADP News ) - Finnish handling systems provider Cargotec Oyj ( HEL : CGCBV ) announced on Friday it won orders worth EUR 10 million ( USD 13.2 m ) to deliver linkspans to Jordan , Morocco and Ireland ."
positive,"We also strengthen our existing partnership with Cybercom '' , says Teleste CTO Esko Myllyla ."
positive,The company is also featured in the Ethibel Pioneer Investment Register and included in Innovest 's Global 100 list of the world 's most sustainable corporations .
neutral,"According to Pietinalho , doctors should motivate their patients who smoke every time they visit their doctors ."
neutral,The continued operations mean the structure after the restructuring of the Aspocomp group including Aspocomp Oulu and the headquarter operations .
negative,"Finnish IT solutions provider Affecto Oyj HEL : AFE1V said today its slipped to a net loss of EUR 115,000 USD 152,000 in the second quarter of 2010 from a profit of EUR 845,000 in the corresponding period a year earlier ."
positive,Olvi has posted a strong set of figures for the first six months of this year .
neutral,"According to business media reports , Usmanov planned to transfer his MegaFon stake to the state-controlled Svyazinvest , in exchange for a stake in the merged RosTelecom ."
neutral,Aspokem posted an operating profit of 2.7 mln euro ( $ 3.5 mln ) and net sales of 89.1 mln euro ( $ 116.8 mln ) in 2006 .
positive,Finnish Bank of +_land reports its operating profit rose to EUR 21.3 mn in the second quarter of 2009 from EUR 6.1 mn in the corresponding period in 2008 .
neutral,Being successful requires providing a level of quality that satisfies our customers and partners .
negative,Peer Peugeot fell 0.81 pct as its sales rose only 6.3 pct from the same period last year .
negative,Thailand says its tourism industry may not recover until 2026. 
neutral,at 9:00 EET Alma Media 's Annual Report for 2009 is scheduled to be published in calendar week 9 .
negative,"As a result of the negotiations , the amount of employment contracts to be terminated is 13 ."
neutral,"GeoSentric is acquiring extra financing by issuing a maximum of 220,000 new shares and a convertible bond with subscription rights for 880,000 shares , which have been fully subscribed ."
positive,The company intends to raise production capacity in 2006 .
positive,Net sales in 2007 are expected to be 10 % up on 2006 .
positive,The Group 's business is balanced by its broad portfolio of sports and presence in all major markets .
neutral,"Currently , the company uses eight similar reach stackers and four empty container handlers by Konecranes ."
neutral,ASSA ABLOY Kaupthing Bank gave a ` neutral ' recommendation and a share price target of 174 crowns $ 24.7 - 19 euro on Swedish lock maker Assa Abloy AB .
neutral,Our purchase to pay solutions enable companies to gain visibility and control over business-critical financial processes .
neutral,The transaction included also the transfer of the lease agreement concerning manufacturing premises and employment agreements related to these operations .
positive,The stock rose for a second day on Wednesday bringing its two-day rise to GBX12 .0 or 2.0 % .
neutral,ABN : 59 087 901 620 now represent 5.10 % of the voting rights and share capital of Citycon Oyj .
neutral,UPM-Kymmene said its has ` not indicated any interest in any domestic consolidations ' .
negative,"Failures by UK agencies contributed to deaths in Fishmongersâ?Hall attack, jury finds. "
neutral,The order is a follow-on to an 11 mln euro ( $ 16.1 mln ) deal made in July 2007 .
positive,The aim is to convert the plants into flexible manufacturers of new and technologically demanding products .
negative,Airline and bank websites go down in another major internet failure. 
neutral,The fair value of investment properties was EUR 2 251.0 ( 1 281.4 ) million .
neutral,Delivery is due in the second half of 2011 .
neutral,The deal will have no significant effect on the acquiring company 's equity ratio .
positive,The companies expect the first orders already in 2011 .
neutral,"The contract also includes cutting and edging wagon parts at Ruukki 's steel service centres in Seinajoki and Raahe , from where they will be delivered to VR for welding and assembly ."
negative,"ADPnews - Aug 3 , 2009 - Finnish media group Ilkka-Yhtyma Oyj HEL : ILK2S said today its net profit fell 45 % on the year to EUR 5.9 million USD 8.4 m in the first half of 2009 ."
neutral,Bertrand Sciard has been the vice chairman of the board of directors of Aldata Solution since April 2007 .
negative,"Operating profit for the 12-month period decreased from EUR5 .4 m while net sales increased from EUR62 .0 m , as compared to the financial year 2004 ."
positive,"Last week , the Finnish metals and technology group announced plans to sell more than 80 percent of its technology unit to further the company 's strategic goal of becoming the world 's largest stainless steel maker ."
neutral,Basware finances the acquisition with a bank loan .
neutral,"The share capital of Alma Media Corporation business ID 1944757-4 is EUR 44,767,513.80 and it is divided into 74,612,523 shares ."
neutral,Viking Line and STX Finland said on Monday that there were plans to build a 240 million euro ferry that would be launched on the Turku-Stockholm route in spring 2013 .
positive,"Also , it is bringing in `` the right kind of people '' to upgrade its human resources ."
neutral,"LONDON ( AFX ) - Intertek Group PLC , a testing and inspection company , said its commercial and electrical division has bought Finland-based company Natlabs Oy from Etteplan Oyj for 1.3 mln eur in cash ."
neutral,"The Finland-based company says it will move into an existing 260,000-square-foot facility in September ."
positive,The value of the firm 's forestry holdings increased by SEK 3.6 bn .
positive,Outotec 's net profit for the second quarter of 2007 jumped to 16.8 mln euro ( $ 23.1 mln ) from 4.6 mln euro ( $ 6.3 mln ) a year ago .
negative,NYC comedy club owner on struggling to reopen. 
neutral,"Established in 1987 , the SRV Group is a private Finnish construction concern with operations in Finland , the Baltic countries and Russia ."
positive,The company will enhance the GPRS capability in the existing 12 IDEA telecom service areas and add 10 more service areas to its network .
neutral,Olli-Pekka Kallasvuo was elected as vice chairman of the Board .
neutral,"The company has also supplied more than 200 MW of power generating equipment for a number of projects in Papua New Guinea , including 12 engines of the Wartsila 32 type to Lihir Gold ."
positive,"Nokia bought Chicago-based Navteq in 2008 , acquiring a maps database to compete with Google s maps as well as with navigation device companies such as TomTom NV and Garmin Ltd. ."
neutral,"It also includes the installation of new equipment , training and start-up services , as well as service work of the shoe press delivered by Vaahto in 2001 ."
neutral,"In the Czech Republic , the smaller profiling unit at Ostrava will be closed and the machinery will be gradually relocated to Ruukki 's bigger plants in Hungary , Poland and Romania by the end of the first quarter of 2009 ."
neutral,The order for plywood mill machinery and equipment announced by Finnish Raute in September 2006 will be delivered to Thebault Plyland in France .
neutral,"Customers wave cards in front of the reader to make payments , similar to `` touch and go '' cards used in transport systems ."
neutral,The credit covers approximately 70 % of the ship 's price .
neutral,"Virala Oy Ab was allocated by the Board of Directors an amount of EUR 1,9 million which is EUR 0,25 million lower than maximum announced on 12/30/2010 ."
neutral,The value of the deal has not been disclosed .
neutral,"The segment has an annual revenue of approximately EUR400m , the company said ."
positive,Ramirent s Danish subsidiary Ramirent A-S has today signed an agreement to acquire the business assets of the machinery rental company Jydsk Materiel Udlejning located in West Jutland .
positive,Operating profit rose to EUR 3.11 mn from EUR 1.22 mn in the corresponding period in 2009 .
neutral,"Teleste 's hybrid TV solution includes components for the whole process of delivering video services to consumers from content acquisition and service creation to delivery through a range of access solutions , including HFC ( hybrid fibre-coaxial ) , xDSL , EttH , and FttH ."
positive,Pretax profit rose to EUR 0.6 mn from EUR 0.4 mn in the corresponding period in 2005 .
negative,"Raute reported a loss per share of EUR0 .86 for the first half of 2009 , against EPS of EUR0 .74 in the corresponding period of 2008 ."
neutral,"Trading code : ELI1V Number of shares : 99,483 Price-share : Gratuitous After the transfer , Elisa holds a total of 10,435,023 own shares ."
positive,"However , the proportion of the paid standing orders grew in 2009 ."
positive,"The GeoSolutions technology will leverage Benefon 's GPS solutions by providing Location Based Search Technology , a Communities Platform , location relevant multimedia content and a new and powerful commercial model ."
neutral,"SDM offers general rental equipment , aluminium scaffolding , power generator and hoists to customers in the construction sector ."
negative,Operating cash flow after investments totalled EUR 61.3 mn compared to EUR 75.3 mn in the corresponding period in 2007 .
neutral,The company closed last year with a turnover of about four million euros .
neutral,"Finnish property investor Sponda said it has agreed a 100 mln eur , five-year mln credit facility with Swedbank and a 50 mln eur , seven-year facility with OKO Bank ."
neutral,Sanoma announced the Stock Option Scheme 2008 on 19 December 2008 .
neutral,Danske Bank is Denmark 's largest bank with 3.5 million customers .
neutral,Financial terms were n't disclosed .
negative,"Additionally , the company will terminate a maximum nine salaried and senior salaried employees ' employment contracts ."
neutral,The order is related to renewing the network of the telecommunications operator .
neutral,The plant is expected to enter commercial operation by mid-2009 .
positive,"Tiimari , the Finnish retailer , reported to have geenrated quarterly revenues totalling EUR 1.3 mn in the 4th quarter 2009 , up from EUR 0.3 mn loss in 2008 ."
neutral,"If needed , she provides also further information on ferry connections and hotels ."
neutral,"In the Baltic countries , Atria 's target is organic growth ."
negative,China's banking regulator warns of global asset bubble risks. 
neutral,- Cash flow from operating activities before investments was EUR 7.6 million EUR 2.5 million .
neutral,L&T also acquired a 50 pct stake in local sector company Salvor Oy at the beginning of September 2007 .
neutral,The share subscription period for stock options 2007A is between 1 April 2010 and 31 March 2012 .
neutral,"Following the impact , the Altima hit a utility pole , causing a live electric line to fall onto the roadway ."
neutral,Mr Jortikka is president of the base metal division of Outotec Oyj in Finland and is on the executive committee of Outotec .
negative,"In the fourth quarter of 2008 , net sales decreased to EUR 121.4 mn from EUR 165.5 mn in the fourth quarter of 2007 ."
neutral,"In a release on Oct. 28 , Peab said the two businesses will continue to be conducted under the brands Cliffton and Stockholm Entreprenad , both part of the Peab Group ."
neutral,"The company 's US subsidiary Vaisala Inc. acquires Aviation Systems Maintenance , Inc ASMI , a Kansas , U.S. based airport service company with over 2.6 million USD net sales in 2008 ."
negative,Kone shares dropped 4.1 percent to  x20ac 43 US$ 55.77 in Helsinki .
neutral,Currently Alfred A Palmberg is putting the finishing touches to one of Finland 's biggest ever re-plumbing and bathroom refurbishment projects also in the district of Vuosaari .
positive,"The company 's net profit amounted to EE 55.5 mn , which was 36 % more than in 2004 ."
neutral,"---------------------------------------------------------------------- -------------- Munich , 14 January 2008 : BAVARIA Industriekapital AG closed the acquisition of Elcoteq Communications Technology GmbH in Offenburg , Germany , with the approval of the"
