Sentiment,Text
positive,`` Our customer has been satisfied with Basware Invoice Automation solution and extends the implementation to new geographies .
negative,Nokia will certainly disagree with Qualcomm 's views on the patent situation .
neutral,`` People who enjoy mobile games are often the same customers who enjoy experimenting with new mobile services and content .
negative,"Operating profit totaled EUR 9.4 mn , down from EUR 11.7 mn in 2004 ."
positive,1 November 2010 - Finnish textile and clothing company Marimekko Oyj ( HEL : MMO1V ) announced on Friday the opening of its first concept store in Seoul in cooperation with Japanese sector player Look Inc ( TYO : 8029 ) .
neutral,Metso Paper 's delivery will comprise an Advantage DCT 200 tissue machine including quality control and distributed control systems ( QCS-DCS ) .
positive,"Kesko 's car import and retailing business , VV-Auto , saw sales grow by 17.1 pct ."
neutral,"This order , when delivered , will bring the total output of electricity in Italy generated by Wartsila equipment to more than 1,300 MW ."
neutral,M-real will start statutory employer-employee negotiations at the +_+Ænekoski board mill that concern about 130 people .
neutral,Ixonos will finance the acquisition through a 3.8 mln euro $ 5.2 mln loan .
positive,"The previously concluded adaptation measures , concerning other staff , were adequate for the time being , and the planning operations continue as before at the plant , the company said ."
neutral,`` Serving customers locally is one of the cornerstones of customer focus for us .
neutral,"The ship cranes , which will be manufactured by MacGREGOR 's partner plants in China , will be delivered between 2008-2010 for vessels ordered by Chinese COSCO , German Peter Dohle and Hong Kong based Cido Shipping ."
positive,"The chain posted sales of 298 million euros for full 2005 , a rise of 19.5 percent , year-on-year ."
neutral,"The company is owned by the State of Finland and the European Aeronautic Defense and Space Company EADS N.V. Tekla is an international software company that provides solutions for building and construction , energy distribution and municipalities ."
positive,Elcoteq has a proven track record in electronics manufacturing services ( EMS ) and a global factory network coupled with modern manufacturing equipment and consistent systems and processes .
neutral,"A In August 2007 , Latvijas Finieris ordered all production lines for a new green veneer mill to be built in Ukmerge , central Lithuania ."
negative,"Net cash flow from operating activities was a negative EUR 3.1 mn , compared to EUR 23.3 mn in the corresponding period in 2009 ."
negative,"Net cash from operating activities was a negative EUR 0.3 mn , compared to EUR 30.9 mn in 2009 ."
positive,"`` The change will optimize the operational efficiencies of our growing business , '' said Julia Prohaska , director of marketing communications for Fiskars ."
positive,"In a release , the Company said that Vocollect T2 customers in North America can now take advantage of its Voice Directed Warehousing solution and increase warehouse efficiency and productivity gains at a discounted price ."
neutral,We offer our customers solutions based on renewable raw materials .
negative,"In Finland , the city of Forssa has said it will not pay compensation to food industry companies HK Ruokatalo and Atria for the lye leak into tap water that occurred in March 2008 ."
neutral,Each share is entitled to one vote .
positive,Operating profit excluding restructuring costs grew to EUR 44.5 million from EUR 31.7 million while operating profit including restructuring costs showed even larger growth to EUR 38.5 million from EUR 7.4 million .
neutral,"Takoma will carry out the transaction by acquiring the entire share capital of Moventas Parkano Oy , which runs the factory in Parkano , southern Finland ."
negative,"Former Boston police commissioner warns of âvery steep, high ratesâ?of violence this summer. "
neutral,"As earlier reported , Nokian Tyres is building a plant in the town of Vsevolozhsk in Russia 's Leningrad Region with an annual production capacity of 4 million tires ."
positive,"In the second quarter of 2010 , Raute 's net loss narrowed to EUR 123,000 from EUR 1.5 million in the same period of 2009 ."
negative,UK failing to plan for impact of climate change despite warnings. 
positive,"According to M-real 's CEO , Mikko Helander , this transaction will enable the company to proceed swiftly with its restructuring program ."
positive,"Revenue in July to September grew 14 percent to ( EURO ) 467 million from a year earlier , the company said Thursday ."
negative,The situation of coated magazine printing paper will continue to be weak .
neutral,The first charging stations will be made available already in 2008 and a whole network is to be ready in 2010 .
neutral,Componenta will also offer a five-year subordinated loan for subscription by the public .
neutral,The contract value amounts to EUR 2.4 million .
neutral,"Yesterday , Legrand issued its E300 million fixed rate deal maturing 2017 ."
neutral,`` Marimekko aims to expand its distribution network primarily by increasing the number of concept stores and shop-in-shops .
positive,"`` P&O Ferries now has a very efficient and powerful vessel for its Dover to Calais route , '' head of the shipbuilder 's Rauma yard , Timo Suistio , said ."
neutral,"Finnish software company QPR Software Plc ( OMX Helsinki : QPR1V ) reported on Thursday ( 23 October ) an operating profit of EUR63 ,000 on net sales of EUR1 .5 m for the third quarter 2008 ."
neutral,"We now have both the opportunity and the responsibility to create a new journalistic culture to serve the readers of Alma Media 's newspapers , `` says Hannu Ollikainen , head of the new Helsinki desk ."
negative,"Kiosk and cinema operations have suffered , in particular ."
neutral,"The portfolio comprises of 118,000 m2 of leasable space with a vacancy rate of roughly 5 % , let to around 140 tenants of which two of the largest are the Swedish government and Ericsson ."
positive,"Clothing retail chain Sepp+Æl+Æ 's sales increased by 8 % to EUR 155.2 mn , and operating profit rose to EUR 31.1 mn from EUR 17.1 mn in 2004 ."
neutral,The phones are targeted at first time users in growth markets .
positive,Rautaruukki said construction group YIT has awarded it a 2.5 mln eur contract to supply the steel structures for a new bridge spanning the Kemijoki river in Northern Finland .
neutral,No financial details were provided .
neutral,Changes to the as-built models from the design were communicated to the subcontractors to accommodate them into the steel and GRC glass reinforced concrete fabrication process .
neutral,Their offering also covers localisation services related to production transfer to the Finnish company 's customers that already have production in Asian market or have made the decision to transfer production there .
negative,Last year 's third quarter result had been burdened by costs stemming from restructuring in the US .
neutral,"In addition , nine fixed-term employment contracts will not be extended and two people will leave the company under pension arrangements ."
neutral,COMPTEL CORPORATION Sami Ervio President and CEO Distribution : NASDAQ OMX Helsinki Major media Comptel Dynamic OSS solutions enable telecom service providers to deliver services flexibly and charge them effectively .
neutral,facades in Riga 8 March 2010 - Finnish construction company YIT Oyj HEL : YTY1V said today that it will build the frame and the facades in a tower construction project in Riga .
neutral,"In December , Amer announced the dismissal of CEO Roger Talermo , who had headed the company since 2006 ."
neutral,"Slower population growth, ageing need not be alarming: economists"
neutral,QPR product family is fully compatible with Microsoft 's Windows 7 operating system .
neutral,"NORDIC BUSINESS REPORT-17 January 2006-Efore Plc inaugurates new plant in Estonia -_ 1998-2006 M2 COMMUNICATIONS LTD Finnish power electronics manufacturer Efore Plc said on Tuesday ( 17 January ) that it was inaugurating its new plant in Parnu , Estonia ."
neutral,"According to Eijkens , a publisher can do much more than just publish colourful books : a publisher can provide value added to information by individualising it ."
neutral,"The payment date is March 25 , 2010 ."
positive,"Finnish GeoSentric , a developer and provider of solutions , products , and technologies for location based services , has preliminary agreed on a EUR 6mn short-term funding with its leading investor ."
negative,The net sales decreased to EUR 49.8 million from EUR 59.9 million .
neutral,"Following the acquisitions , Panostaja will establish a new business unit which will focus on heat treatment of metals ."
neutral,"The airline was targeting travel agents , tour operators and travel management companies to raise awareness first before targeting consumers , he added ."
neutral,E 's building system service had revenue of EUR 355 mln in 2007 .
positive,The stock rose for a third day on Tuesday bringing its three-day rise to GBX10 .50 or 1.8 % .
positive,"The planned facility , estimated to cost around $ 814 million , would be the largest biodiesel plant in the world , and use palm oil certified by the Roundtable on Sustainable Palm Oil ( RSPO ) ."
neutral,Raffles Equities Ltd became a substantial holder in Archer Exploration Ltd on January 12 with 11.7 million shares ( 18.2 pc ) .
neutral,Uber to buy remaining stake in online grocer Cornershop
neutral,The ore body is sufficient to support anticipated production for at least 46 years .
neutral,"Sanoma Learning & Literature , offering print and digital learning materials , is present in eleven countries ."
positive,"Finnish energy company Fortum Oyj said on November 13 , 2007 it was granted an environmental permit to build a biofuel-fired combined heat and power CHP plant in Vartan harbor in eastern Stockholm ."
positive,"Comparable net sales are expected to increase more than 10 % in 2008 , in line with group target ."
neutral,Net sales in 2007 totalled EUR 329 million and the operating margin was above 19 % .
positive,"ADP News - Nov 13 , 2008 - Finnish printed circuit board PCB maker Aspocomp Group Oyj OMX : ACG1V said today that its net loss narrowed to EUR 2 million USD 2.5 m in the first nine months of 2008 from EUR 57"
neutral,"Please inform IR Johanna Koskinen of your participation no later than 20 April at 10 a.m. A telephone conference for financial analysts and investors , conducted in English , will begin at 3:00 p.m. Finnish time ( EET ) ."
neutral,Tekla Structures 16 is ` all about you and your team ' and compatible with the Windows 7 operating system .
neutral,"EQ Bank forecasts Olvi 's net sales at EUR 67mn in the second quarter of 2009 , and operating profit at EUR 6.4 mn ."
neutral,CapMan made its initial investment in OneMed in June 2006 .
positive,27 January 2011 - Finnish IT solutions provider Affecto Oyj ( HEL : AFE1V ) said today it has won a EUR1 .2 m ( USD1 .6 m ) contract from state-owned Lithuanian Social Insurance Institution ( SODRA ) .
positive,"In Middle East & North Africa , Tecnotree has grown considerably in the recent years ."
neutral,An Android app will be coming soon .
neutral,UNC Charlotte would also deploy SSH Tectia Connector to enable secure application connectivity .
neutral,"Componenta is a metal sector company with international operations and production plants located in Finland , the Netherlands , Sweden and Turkey ."
neutral,"In a note to clients published , the Dutch broker described the company 's third quarter results as ` soft ' , although it also noted that Elcoteq retained its guidance , dealers said ."
neutral,Finnish paints and coatings company Tikkurila Oyj ( HEL : TIK1V ) announced today the launch of Tikkurila ProHouse method for protection of wooden surfaces via treatment with Ultra Pro waterborne products .
negative,"Pretax loss totalled EUR 49.9 mn , compared to a loss of EUR 15.4 mn in the corresponding period in 2008 ."
neutral,Atria will also buy the shares of Kauhajoen Teurastamokiinteistot Oy (Kauhajoki slaughterhouse property)from Itikka Co-operative .
neutral,"With the new arrangement , customer responsibilities will become mainly regional ."
neutral,"In Finland , the five largest brands control 90 % of the beer market ."
negative,"Finnish electronics contract manufacturer Scanfil had net sales of EUR 52.2 mn in the first quarter of 2007 , down from EUR 60.1 mn a year before ."
negative,"However , the company saw its net profit for the third quarter down to EUR 1.4 million from EUR 1.5 million for the corresponding period of 2009 ."
positive,"`` Beyond the improved voice capabilities , customers now have a streamlined way to comply with recalls and other traceability requirements , providing them with a competitive advantage ."
negative,"YIT lodged counter claims against Neste Oil totaling some EUR25m , primarily based on work carried out under the contract and additional costs incurred due to prolongation of the project ."
negative,One of the challenges in the oil production in the North Sea is scale formation that can plug pipelines and halt production .
negative,"In Q1 of 2009 , Bank of +_land 's net interest income weakened by 10 % to EUR 9.1 mn ."
negative,Finnish forest industry group Stora Enso Oyj issued on Thursday ( 20 March ) a profit warning for the first quarter 2008 .
positive,Nokia was up 0.12 pct to 16.70 eur after kicking off the morning in negative territory .
negative,"As a result of the negotiations , the company will terminate total 5 employment contracts ."
positive,"According to ACNielsen 's ScanTrack study for the period week 10 of 2005 to week 9 of 2006 , Coca-Cola is the market leader in soft drinks in Finland ."
positive,Finnish Outotec has been awarded a contract to supply a new zinc roaster with gas cleaning and sulphuric acid plant for the OZK Kardzhali zinc smelter in Bulgaria .
neutral,"Mr. Mika Korpinen , APAC Vice President for Comptel concludes : `` Comptel is once again demonstrating the importance of providing reliable delivery and enabling time-to-market ."
positive,"Both operating profit and net sales for the six-month period increased , respectively from EUR7 .5 m and EUR655 .5 m , as compared to the corresponding period in 2005 ."
positive,"HELSINKI (Thomson Financial)- Kemira GrowHow swung into profit in its first quarter earnings on improved sales , especially in its fertilizer business in Europe , which is normally stronger during the first quarter ."
positive,"Russian export duties will activate harvesting in Finland , and sales in Russia will increase also ."
neutral,The second-quarter net sales are expected to be on par with the first quarter of 2009 .
negative,"Jul. 18 -- Police are looking for a man who they say terrorized three males at gunpoint on East Maple Avenue this afternoon , shooting one of them and kidnapping another ."
positive,Sports equipment sales also progressed well owing to the prolonged winter season .
neutral,"She will succeed Krister Kylas , who has decided to leave TeliaSonera ."
positive,"Both operating profit and net sales for the three-month period increased , respectively from EUR15 .1 m and EUR131 .5 m , as compared to the corresponding period in 2005 ."
positive,"Finnish industrial investor Panostaja Oyj OMX Helsinki : PNAAS OMX Helsinki : PNABS said on Friday 11 July that it has signed a deal to acquire the entire share capital of Kospa Oy , the manufacturer of waste disposal equipment ."
neutral,"The contracts between Raute Corporation and Muling Kemian Wood Products Co. , Ltd. , which were announced on 3 November 2010 , have taken effect ."
neutral,"The major part of the deliveries include different AC and CXE amplifier solutions and products by Belgian DINH Telecom , a broadband solutions company acquired by Teleste in the spring of 2007 ."
neutral,"It is positive that the company it recruited Harri Koponen as CEO , according to Affarsvarlden ."
positive,YIT says the acquisition is a part of its strategy for expansion in Central and Eastern European markets .
positive,Eurozone business growth at 15-year high as demand unleashed
neutral,"To showcase our end-to-end capabilities at the Mobile World Congress , we arranged an internal MeeGo application development competition to entice developers to create new applications ."
neutral,`` Our approach is very much to only use raw materials that are produced in line with the principles of sustainable development .
positive,This transaction will also rationalize our pulp and paper industry related solutions .
positive,10 February 2011 - Finnish media company Sanoma Oyj HEL : SAA1V said yesterday its 2010 net profit almost tripled to EUR297 .3 m from EUR107 .1 m for 2009 and announced a proposal for a raised payout .
positive,"S&P 500 Hits Another Record, Boosted by Bank Stress Tests, Infrastructure Deal; Dow Outperforms NASDAQ"
negative,"Finnish Scanfil , a systems supplier and contract manufacturer to the communications sector and the electronics industry , reports its net sales totalled EUR 94.7 mn in the first half of 2010 , down from EUR 99.5 mn in the first half of 2009 ."
neutral,"mr Bakman sees also expansion options on the Tallinn-Helisnki link , claiming however , that operating the link with only a single ship is not enough ."
positive,"Furthermore , Novator Finland Oy has entered into a securities lending agreement , whereby Novator Finland Oy will hold directly the same amount of shares that are underlying of the OMX market forwards from May 23 through May 26 , 2008 ."
neutral,"ITG 's share in the deal is estimated at some 500,000 euro $ 627,000 ."
neutral,"China Unicom , NYSE : CHU , HKSE : 0762 , and SHSE : 600050 , the second largest mobile carrier in the country ."
negative,"UPM-Kymmene Corp. , the world 's largest maker of magazine paper , on Tuesday reported a 19-percent profit drop as lower paper prices , higher costs and a strong euro hurt revenue ."
neutral,`` BG Crane has been a strong partner for Hiab in Australia for many years .
neutral,Another noticeable thing is that the search for Tata and Airtel brands was mostly related to ` broadband connections ' .
neutral,Arena Partners Oy is a development company for electronic business .
neutral,"The machine will have an annual production capacity of 200,000 tonnes of super-calendered magazine paper and other paper grades based on recovered fiber , Stora Enso said ."
positive,"The previously concluded adaptation measures concerning the other personnel are adequate for the time being , Raute said ."
positive,SCANIA Morgan Stanley lifted the share target on Swedish heavy-duty truck and bus maker Scania AB to 330 crowns ( $ 42.4 - 35.2 euro ) from 310 crowns ( $ 39.8 - 33.1 euro ) .
neutral,All rights reserved .
positive,"`` Nokia 's Calling All Innovators Africa competition has been specifically launched to enable developers to create locally relevant , best-of-breed mobile applications . ''"
neutral,"`` Because we 're a pension insurance company , we 're required to diversify and not put too much in one asset class ."
negative,Operating profit fell to EUR 6.2 mn from EUR 8.5 mn in the third quarter of 2007 .
neutral,Terms of the acquisition were not disclosed .
positive,Both the net sales and operating profit were record high in the company 's history .
neutral,"The Nokia Music Store begins trading on Tuesday , selling singles and albums as well as live music streaming ."
neutral,"Through the Nordic Exchange , OMX offers access to approximately 80 percent of the Nordic and Baltic securities market ."
positive,Finnish Bore that is owned by the Rettig family has grown recently through the acquisition of smaller shipping companies .
neutral,"The first four of the new shop-in-shops will be opened this spring : on Madison Avenue in New York as well as in Chicago , Los Angeles and San Francisco ."
neutral,"Thanks to its extensive industry and operations experience , Cybercom offers strategic and technological expertise to these markets : telecom , industry , media , public sector , retail , and banking and financial services ."
neutral,"The Annual Report will be sent automatically to shareholders holding at least 2,000 Sampo plc shares ."
neutral,"The firm 's UK head office is in Rugby Road , Lutterworth ."
positive,Finnish Cargotec has been awarded a significant order for a total of 292 Hiab loader cranes by BAE Systems in the US .
positive,"As a result , the Russia 's import restrictions on Finnish dairy companies will be canceled on 6 August 2010 ."
neutral,Managing Director Timo Kohtam+Æki of Lemmink+Æinen Infra nevertheless points out the continued need for infrastructure construction in the Baltic markets .
neutral,"Finnish bank Pohjola Bank Plc HEL : POH1S said today that it will issue a EUR 40 million USD 51.2 m index-linked bond , Pohjola Tutkimuksen Tahdet VIII-2010 Pohjola Research Stars VIII-2010 , on October 27 , 2010 ."
neutral,Quality chargers under CHARGZ brand are sold in selected retail stores and other sales locations world-wide .
neutral,"Tyrvaan Sanomat , published twice a week by Tyrvaan Sanomat Oy , appears in Sastamala and Kiikoinen ."
neutral,Sanoma Magazines International will invite other shareholders holding approximately 15 % of the shares to sell their shares .
positive,"The metal has gained 41 percent this year as demand from China , the world 's largest user , increased ."
neutral,Amanda Capital has investments in 22 private equity funds and in over 200 unquoted companies mainly in Europe .
neutral,"The operations to be sold include manufacturing units in Finland , France , Poland and Turkey , as well as sales units in Germany and Lithuania ."
positive,Vacon 's cash flow from operations grew to EUR 37.1 mn from EUR 21.9 mn a year ago .
positive,"`` In terms of profitability and earnings 2007 was the best year in our history , '' Chief Executive Veli-Matti Mattila said ."
positive,"Kai Tulonen , Chief Technology Officer , SysOpen Digia says : `` Mobility Business Suite represents a significant milestone in the company 's offering to the telecommunications industry ."
neutral,Vacon 's office will support its customers in Brazil and South America .
neutral,"HK Ruokatalo produces many turkey products , such as cold cuts ."
negative,"Finnish Bank of +_land reports operating profit of EUR 2.2 mn in the first quarter of 2010 , down from EUR 6.3 mn in the corresponding period in 2009 ."
positive,It is now the leading private road ambulance service company in Finland .
positive,"Nevertheless , its market share rose to 49.14 percent from 48.51 percent a year earlier ."
negative,The airline 's share price closed down slightly at (  x20ac ) 12.51 ( $ 15US .74 ) in Helsinki .
neutral,The arrival of digital currencies is getting closer
positive,"The financial impact is estimated to be an annual improvement of EUR2 .0 m in the division 's results , as of fiscal year 2008 ."
neutral,"The Marubeni Group focuses on creating `` value chain '' from upstream to downstream , encompassing a wide variety of business fields , including oil & gas , metals , mineral resources , foods , pulp & paper and chemicals , among others ."
neutral,"The Internal Revenue Service sees about 20 percent of all taxpayers wait until the last two weeks to file , with about 40 million returns filed in April ."
neutral,"Creating interfaces that are more similar to interactions in the real world can enable experiences that are more natural and intuitive , in the same way that modern games and movies are more immersive through the use of realistic 3-D graphics ."
neutral,The agreement includes the entire process of managing Mercator 's supply chain in all regions where the company is currently present .
neutral,"3 January 2011 - Scandinavian lenders Sampo Bank ( HEL : SAMAS ) , Pohjola Bank ( HEL : POH1S ) and Svenska Handelsbanken ( STO : SHB A ) have provided a EUR160m ( USD213m ) line of credit to Lemminkainen Oyj ( HEL : LEM1S ) , the Finnish construction firm said on Friday ."
positive,The representative body of Swedish Meats approved an improved offer from Finnish HK Ruokatalo to acquire the company .
negative,"Profit before taxes amounted to EUR 56.5 mn , down from EUR 232.9 mn a year ago ."
neutral,"The contract covers turnkey deliveries to all five airports operated by the authority -- John F Kennedy , LaGuardia , Newark , Teterboro and Stewart International ."
negative,"Sales in Finland decreased by 10.5 % in January , while sales outside Finland dropped by 17 % ."
neutral,"In January-September 2007 , operating profit totaled EUR 20.5 mn ."
neutral,`` With this new version it is very important for us to introduce a BIM process that is based on the detailed building information model .
neutral,"Okmetic closed its plant in Espoo in early 2004 , and all production lines from the site were moved to Okmetic 's plants in Vantaa , Finland and Texas , USA ."
neutral,"On preliminary estimate , the hotel will operate under the brand Novotel ."
negative,The operating margin came down to 2.4 % from 5.7 % .
positive,"Suominen Corporation estimates that the cost-cutting program that started in autumn 2005 , higher sales prices , and expected growth in volume of Wet Wipes , will make the company 's operations more profitable ."
positive,"`` We are happy to be working with Rapala to encourage boaters and anglers to introduce newcomers to the sport , '' said RBFF President & CEO Frank Peterson ."
neutral,"The company will use the money for product development and research activities through 2013 in its key markets Finland , Germany , Italy and France ."
