Sentiment,Text
positive,"Pioneer Library System was one of 127 libraries , municipalities , arts , culture and higher education and science organizations to have been awarded grants to participate in The Big Read , the largest federal reading program in U.S. history ."
positive,"`` This is a significant milestone for Benefon , helping us to secure critical USP 's for our personal navigation product roadmap for 2007 and beyond , '' commented Simon Button , Chief Technology Officer at Benefon ."
neutral,It was decided that the auditors are reimbursed according to invoice .
neutral,"In addition , the contract includes modification of the effluent treatment plant at Follum ."
neutral,The proposal of the shareholders to elect Mr. Hannu Krogerus to the Board is based on his long and unrivalled experience and knowledge of all matters related to Elcoteq .
negative,"( ADPnews ) - Feb 3 , 2010 - Finland-based steel maker Rautaruukki Oyj ( HEL : RTRKS ) , or Ruukki , said today it slipped to a larger-than-expected pretax loss of EUR 46 million ( USD 64.5 m ) in the fourth quarter of 2009 from a"
positive,"NAVTEQ has a commanding lead in installed map data systems in North American vehicles and may be the leader in turn-by-turn navigation data offered by services such as OnStar in North America , said analyst Phil Magney of Telematics Research Group in Minnetonka , Minn. ."
positive,"In the beginning of this year , Wartsila had secured an order to deliver four gas-fuelled main engines and propulsion machinery for the same vessel ."
positive,FINANCING OF ASPOCOMP 'S GROWTH Aspocomp is aggressively pursuing its growth strategy by increasingly focusing on technologically more demanding HDI printed circuit boards PCBs .
positive,"The OMX Nordic 40 ( OMXN40 ) index , comprising the 40 most traded Nordic stocks on the Nasdaq OMX exchange , closed up 0.43 % at 1,138.84 points on Wednesday ."
neutral,The shares carry a right to dividend and other shareholder rights as from their registration with the Finnish Trade Register .
positive,"Operating profit totaled EUR 37,7 mn , up slightly from EUR 37.2 mn in the corresponding period in 2006 ."
neutral,Metsa-Botnia will sell 82.1 % of its stake in the Uruguayan companies and Metsaliitto -- 5.5 % .
neutral,At CapMan Haavisto will be responsible for Group Finances and Accounting and IT .
neutral,"Previously , the company expected its 2008 financial performance to remain at the same level as in 2008 ."
positive,"The transaction will have a positive impact of around EUR2m on earnings , which Ruukki will recognize during the fourth quarter of this year ."
neutral,The company said shareholders will be able to vote on the agreement at an EGM scheduled for later this month .
neutral,Marimekko is considering further measures in the matter .
negative,"Finnish Kemira 's net sales EUR decreased to EUR 1,259.6 mn in January-June 2009 from EUR 1,425.1 mn in January-June 2008 ."
neutral,"Swedbank Hypotek - Is to issue a benchmark , fixed rate covered deal in Euros , maturing January 2010 ."
negative,Ruukki Group calculates that it has lost EUR 4mn in the failed project .
neutral,It is the first application in the market for invoice and purchase requisition approval with a mobile device .
positive,"Key shareholders of Finnish IT services provider TietoEnator Oyj on Friday rejected a hostile EUR1 .08 billion $ 1.67 billion offer from buyout shop Nordic Capital , giving new life to a possible counter offer from Blackstone Group LP and Norwegian telecom Telenor ASA ."
neutral,"CS Cabot exports 55 % of its production mainly to Goodyear , Bridgestone and Michelin plants in Poland , as well as to Germany 's Michelin or Italy 's Pirelli through the company 's logistics center in Paris , Stefan said ."
neutral,"The government started the sell-off last month , putting an 8 percent stake in TeliaSonera on the auction bloc ."
positive,The announced restructuring will significantly decrease the Company 's indebtedness .
neutral,"wins 98 % acceptance 23 December 2009 - Finnish industrial machinery company Metso Oyj ( HEL : MEO1V ) said today it will complete its takeover offer for textile company Tamfelt Oyj Abp ( HEL : TAFKS ) , after acquiring 98 % of its shares and votes ."
neutral,The combined capital of these funds is expected to be EUR 100mn-150mn .
neutral,"The product advisory does not apply to any other Nokia-branded battery , the company said ."
neutral,Also the development of online businesses will continue .
neutral,The total value of the contract is some EUR 8 million .
positive,Sales of security and system packaging increased slightly .
negative,Diluted earnings per share ( EPS ) fell to EUR 0.63 from EUR 1.71 .
neutral,GE is building the facility with wind power developer Invenergy Wind LLC .
positive,A new production line is being completed for the contract production of hormone treatments .
positive,Shareholders of Rakvere Lihakombinaat decided in favor of the buyout of minority shares in mid-July .
neutral,"The Lemminkainen Group , headquartered in Helsinki , Finland , operates in all sectors of the construction industry : civil engineering , building contracting , technical building services and the building materials industry ."
neutral,"Biohit Oyj develops , manufactures and markets liquid handling products and diagnostic test systems for use in research , healthcare and industrial laboratories ."
negative,"- The Group 's sales during the period were EUR 37.5 million ( EUR 48.2 million , 1-9/2008 ) and result before taxes was a loss of EUR -3.5 ( +1.2 ) million ."
positive,Operating profit margin increased from 11.2 % to 11.7 % .
positive,The volumes are expected to increase during the next few years .
positive,"Cargotec Corporation , Press Release , August 26 , 2008 at 10 a.m. Finnish time Cargotec 's MacGREGOR business area providing marine cargo handling and offshore load handling solutions has received significant offshore crane retrofit order ."
negative,"Dolce & Gabbana has asked the European Union to declare Marimekko Corporation 's `` Unikko '' floral pattern trademark invalid , in a continuing dispute between the two companies ."
positive,These moderate but significant changes resulted in a significant 24-32 % reduction in the estimated CVD risk .
neutral,Country : ; Germany Sector : Construction-Real Estate ; Machinery-Engineering Target : Caverion GmbH Buyer : YIT Oyj Deal size in USD : 90.3 m Type : Corporate acquisition Status : Agreed
neutral,The Oxyview Pulse Oximeter is a common device to check patient blood-oxygen saturation level and pulse rate .
negative,"Comparable operating profit totaled EUR 4.7 mn , down from EUR 5.1 mn in the corresponding period in 2005 , representing 7.4 % of net sales ."
neutral,"Jensen , Njastein and Mike Critch , the head of Dovre North America business unit , will report to Toivola ."
neutral,The contract includes an option to deliver an additional 75 ASCs in the next phases of the project .
negative,Scanfil issued a profit warning on 10 April 2006 .
negative,The union filed a grievance over the company 's overtime assignment policies .
neutral,"The connectivity unit has more than 100 e-invoice customers , and the number of annual transactions stands at nearly one million ."
neutral,"Janis Arbidans , CEO of YIT Celtnieciba , said the company was focusing on housing and real estate development market ."
neutral,Elcoteq has a global network of After Market Service sites which have a long experience in serving Consumer Electronics and Systems Solutions customers .
positive,`` The trend in the sports and leisure markets was favorable in the first months of the year .
positive,"The total delivery volume of paper businesses in 2010 was 1,155,000 tonnes , up from 1,132,000 tonnes in 2009 ."
negative,"In the building and home improvement trade , sales decreased by 6.3 % , totalling EUR 154.1 mn ."
neutral,The effect of the savings will be noticeable from the beginning of 2010 .
neutral,Below are unaudited consolidated results for Aspocomp Group under IFRS reporting standards .
neutral,"CHS Expo Freight is a major Finnish fair , exhibition and culture logistics company that provides logistics services to various events by land , air and sea ."
positive,"Profit before taxes was EUR 5.4 mn , up from EUR 3.6 mn a year earlier ."
negative,Operating profit for continuing operations fell to EUR 48.3 mn from EUR 72.4 mn in the first half of 2007 .
neutral,AffectoGenimap builds highly customised IT solutions for its customers in Finland and the Baltic countries .
negative,"All the ferries had run into trouble just outside the Stockholm archipelago , made up of more than 20,000 islands ."
positive,"Renzo Piano 's building design will be a wonderful addition to London 's skyline , '' says Noud Veeger , EVP and Area Director for Central and North Europe at KONE ."
neutral,Poyry is a global expert in consulting and engineering .
neutral,"The corresponding increase in the share capital due to these subscriptions with the warrants , in total EUR 1,860.74 , was registered with the Finnish Trade Register on January 4 , 2008 ."
negative,Cash Flow from Operations for the most recent quarter also reached a eight year low .
positive,"In January-September 2010 , Fiskars ' net profit went up by 14 % year-on-year to EUR 65.4 million and net sales to EUR 525.3 million from EUR 487.7 million ."
positive,Amazon wants to make your life easier. Here's how it's changing grocery shopping
negative,"ADP News - May 29 , 2009 - Bank of America BofA downgraded today its ratings on Swedish-Finnish paper maker Stora Enso Oyj HEL : STERV and on Finnish sector player UPM-Kymmene Oyj HEL : UPM1V to `` underperf"
neutral,"The orders consist in total of over 1,600 panels of lift-away weatherdeck hatch covers and they will be delivered for container vessels with capacities ranging from 2,000 to 13,300 TEUs ."
neutral,"New Chairman of the Board of Directors , Mr Chaim Katzman , will give a presentation and answer questions ."
positive,"Meanwhile , Nokia said that it will be able to deliver a complete range of services from deployment operations to consulting and integration to managed services as a result of the buyout ."
negative,"Rapala VMC Corporation STOCK EXCHANGE RELEASE October 10 , 2008 at 11.45 am Kaupthing Bank Oyj ( `` Kapthing '' ) has informed Rapala VMC Corporation ( `` Rapala '' ) that it has interrupted the liquidity providing for Rapala 's share for the time being ."
positive,The objective of the planned measures is to achieve significant savings in the next few years .
negative,"have notified that as a result of the Company issuing 14,432,000 new shares in the directed offering , the joint holdings of Pequot has decreased below 1-10 to 9.63 % of total number of shares and votes in the Company ."
neutral,"At 10.58 am , Outokumpu declined 2.74 pct to 24.87 eur , while the OMX Helsinki 25 was 0.55 pct higher at 2,825.14 and the OMX Helsinki added 0.64 pct to 9,386.89 ."
negative,The stock was hit by the profit warning of Finnish rival Rautaruukki Oyj ( OMX : RTRKS ) .
neutral,The company has an annual turnover of EUR32 .8 m.
negative,"Myllykoski , with one paper plant in Finland , one in the US and three in Germany , had revenues of EUR286m in the first half of 2010 and an operating loss of EUR12m , Reuters said ."
neutral,Juha Haapakoski will continue as Editor-in-Chief with budget responsibility also with the new publisher .
negative,"Operating margin , however , slipped to 14.4 % from 15.1 % , dragged down by a poor performance in enterprise solutions ."
positive,"Re-use back into PET bottles has also steadily increased and the rate of use in strapping tape has picked up again after a dip in 2005 , Petcore said previously ."
neutral,"A total of 15,000 new Citycon shares with a nominal value of EUR 1.35 per share were subscribed between 17 and 23 March 2006 exercising the A-B-C options based on the company 's stock option plan 1999 ."
neutral,"The company is in charge of all natural gas storage activities in France , Great Britain , and Germany ."
positive,"EPS for the quarter was EUR0 .00 , as compared with EUR0 .01 in the third quarter of 2008 , representing a Group net sales for the third quarter were EUR15 .3 m , up by 2.8 % as compared with EUR14 .9 m in the third quarter of 2008 ."
neutral,Customers in a wide range of industries use our stainless steel and services worldwide .
neutral,It 's not .
positive,Finnish Cargotec 's Kalmar has received a significant order from the US Department of Defense .
positive,It will also strengthen Ruukki 's offshore business .
positive,"Net sales went up by 1 % year-on-year to EUR 29 million , affected by the business acquisitions , realized during the previous financial period , the effect of which was EUR 5.1 million on the review period ."
positive,"Operating profit totalled EUR 7.0 mn , up from a loss of EUR 4.0 mn in the second quarter of 2009 ."
negative,The move was triggered by weak demand for forestry equipment and the uncertain market situation .
neutral,As an overall effect of the above-mentioned measures Glaston will recognize non-recurring expenses of EUR 12 million in the fourth quarter of 2008 .
neutral,Currently more than 100 of Global Fortune 500 companies are using SSH security solutions .
positive,"Excluding non-recurring items , pre-tax profit surged 45 % to EUR80m ."
negative,"The company 's annual loss amounted to EEK 18mn , compared to a profit of EEK 7.3 mn in 2008 ."
negative,Operating profit in the fourth quarter fell to EUR33m from EUR39m a year earlier .
positive,Stora Enso 's third-quarter pre-tax profit doubled to EUR 197mn .
neutral,"Incap Contract Manufacturing Services Pvt Ltd , a subsidiary of Incap Corporation of Finland , is acquiring the manufacturing unit of the TVS Electronic Ltd at Tumkur , near Bangalore , for Rs40 crore ."
neutral,The company also said that it will sell approximately 150 hectares of land to the city of Valkeakoski by the end of the year a part of its `` From job to job '' program .
neutral,"We know that it exists , '' Artemyev said ."
neutral,The transaction is planned to be financed with a EUR40m market-based loan granted by Standard Chartered Bank Hong Kong .
neutral,Bank risk officers put climate at top of agenda
neutral,The shipyard hopes the regional government in Andalusia can offer its some form of financial support .
negative,"Based on the first quarter result , existing order backlog and new order prospects , the company expects that full-year sales will contract by 25 % from 2008 , the gross margin will stay at a healthy level , and the operating profit margin will be lower than in 2008 due to lower sales volume ."
neutral,"The Annual Report contains the financial statements , the consolidated financial statements , the report by the Board of Directors and the auditor 's report ."
positive,Finnish consumer packaging manufacturer Huhtamaki Oyj said it swung to a net profit of 84.1 mln euro $ 105.6 mln in the first nine months of 2006 from a net loss of 2.6 mln euro $ 3.3 mln in the same period of 2005 .
neutral,ND = Not disclosed .
positive,"Previously , the company anticipated its operating profit to improve over the same period ."
neutral,The opening of the portal is part of the expansion strategy of Alma Media 's Marketplaces business unit .
neutral,The duration of the lay-offs per employee will vary from one to six weeks .
positive,"October-December sales were 302 mln eur , or a 25.3 pct increase year on year ."
positive,"Operating profit for the three-month period increased from EUR1 .2 m , while revenue increased from EUR20 .2 m , as compared to the corresponding period in 2005 ."
neutral,The new activity will incur an investment of about 5 MEUR .
neutral,cents Recognize potential partnerships and suppliers .
positive,TeliaSonera said about $ 100 million will be invested in the next year in the region to bring mobile coverage to about 90 % of Nepal s population .
positive,"is planning to expand its product portfolio in the harbor segment , chief executive Pekka Lundmark told Financial Times Deutschland ."
negative,"Loss after financial items totalled EUR 9.7 mn , compared to a profit of EUR 1.3 mn in the corresponding period in 2008 ."
positive,"`` We love Activision 's fresh , colorful approach to Rapala : We Fish , '' said Kelly Brockpahler , Rapala ."
negative,"Thanks to the internet , consumers compare products more than previously and Finnish companies are not competitive ."
neutral,Russia wants to utilise its huge forest reserves in a very different way from what has been done so far .
neutral,"An estimated 30 pct of mobile calls are made from the home , and France Telecom hopes that 15 pct of its Orange clients will sign up for the service by the end of 2008 ."
neutral,The value of the contracts is about EUR 3.3 mn .
positive,"Order intake , on the other hand , is expected to be stronger than in 2007 ."
negative,"Due to the rapid decrease in net sales , personnel reductions have been carried out on a wider scale than initially expected ."
neutral,"The order includes a log handling line , peeling line and drying line for the production of parquet base layer veneer for Plyfa 's Hassela mill , central Sweden ."
negative,Finnish insurance company Fennia and Kesko Group are ending their loyal customer cooperation .
negative,"The international electronic industry company Elcoteq has laid off tens of employees from its Tallinn facility ; contrary to earlier layoffs the company contracted the ranks of its office workers , the daily Postimees reported ."
